{
  "$schema": "./schemas/generative-scene-contract.schema.json",
  "schemaVersion": "0.2.0",
  "contract": {
    "id": "antikylabs.scene.blue-winter-grove",
    "kind": "generative-scene",
    "name": "Blue Winter Grove",
    "revision": 2,
    "status": "draft",
    "intent": "Define a reproducible, relationship-driven, high-density voxel winter grove that can be generated, rendered, measured, reviewed, and iteratively improved by humans and agents.",
    "nonGoals": [
      "runtime gameplay logic",
      "combat or interaction systems",
      "final renderer implementation details",
      "hand placement of every generated asset instance",
      "photorealism",
      "a generic reusable forest biome before this vertical slice succeeds"
    ],
    "tags": [
      "antiky",
      "research-gem",
      "voxel",
      "winter",
      "generative-contract",
      "vertical-slice"
    ],
    "authoredFor": "Antiky generative world pipeline research gem",
    "provenance": {
      "contractLayer": "authoring-ir",
      "sourceConversation": "Antiky image-to-contract and voxel generation design",
      "expectedCompilerOutput": "fully-resolved canonical JSON IR with prototype inheritance removed",
      "notes": "This file intentionally includes verbose descriptions and acceptance rationale so it can serve as both an executable example and a design reference."
    }
  },
  "imports": [
    {
      "id": "antikylabs.core-component-catalog",
      "uri": "./schemas/component-catalog.json",
      "version": "0.1.0",
      "optional": false
    }
  ],
  "coordinateSystem": {
    "handedness": "right",
    "upAxis": "y",
    "horizontalAxes": [
      "x",
      "z"
    ],
    "worldUnit": "meter",
    "voxelSizeM": 0.1,
    "originMeaning": "center of the primary scene bounds at terrain reference elevation"
  },
  "determinism": {
    "rootSeed": "blue-winter-grove-v2-seed-1847",
    "streamPolicy": "hash(rootSeed, contractId, entityId, systemId, purposeKey)",
    "stableInputs": [
      "schemaVersion",
      "contract.id",
      "contract.revision",
      "entity.id",
      "prototype.id",
      "system.id",
      "purposeKey"
    ],
    "streams": {
      "layout": "layout/*",
      "terrain": "terrain/*",
      "population": "population/<population-id>",
      "asset": "asset/<derived-instance-id>/<purpose-key>",
      "surface": "surface/<derived-instance-id>/<purpose-key>",
      "detail": "detail/<derived-instance-id>/<purpose-key>"
    }
  },
  "qualityProfile": {
    "presentation": {
      "visualLanguage": "rich dense voxel diorama",
      "cameraRead": "layered three-quarter scene with a clear focal tree and protected clearing",
      "targetDistance": "beautiful at scene scale and credible in close asset crops",
      "antiStyles": [
        "Minecraft",
        "toy block set",
        "single-cone low-poly trees",
        "flat palette swaps",
        "uniform noise everywhere"
      ]
    },
    "detailBudget": {
      "macro": {
        "priority": 1.0,
        "targets": [
          "terrain silhouette",
          "clearing shape",
          "canopy height rhythm",
          "foreground-midground-background separation"
        ]
      },
      "meso": {
        "priority": 1.0,
        "targets": [
          "branch tiers",
          "tree clusters",
          "snow shelves",
          "rock fractures",
          "shrub lobes",
          "snow drifts"
        ]
      },
      "micro": {
        "priority": 0.72,
        "targets": [
          "bark fissures",
          "twig clusters",
          "grass tips",
          "lichen",
          "contact snow compression",
          "small broken branches"
        ]
      }
    },
    "densityTargets": {
      "generatedTreeInstances": [
        94,
        164
      ],
      "generatedGroundDetailInstances": [
        390,
        829
      ],
      "uniqueTreeSilhouetteRatioMin": 0.9,
      "visibleDetailClassesHeroViewMin": 8,
      "visibleDetailClassesGroundViewMin": 12
    },
    "renderTargets": {
      "heroResolutionPx": {
        "width": 1920,
        "height": 1080
      },
      "assetDetailResolutionPx": {
        "width": 1600,
        "height": 2000
      },
      "requiredPasses": [
        "beauty",
        "albedo",
        "normal",
        "depth",
        "object-id",
        "material-id",
        "snow-coverage"
      ]
    }
  },
  "definitions": {
    "palettes": {
      "palette.winter-snow": {
        "id": "palette.winter-snow",
        "intent": "Cool snow ramp with enough value separation to preserve surface form under blue-hour light.",
        "roles": {
          "deepShadow": [
            "#15243A",
            "#1D3150"
          ],
          "ambientShadow": [
            "#294567",
            "#365A7C"
          ],
          "body": [
            "#7898B6",
            "#9DB5C9"
          ],
          "softHighlight": [
            "#C7D5DF",
            "#E1E8EB"
          ],
          "specularAccent": [
            "#F3F7F8"
          ]
        },
        "constraints": {
          "pureWhiteCoverageMax": 0.015,
          "minimumValueSteps": 6,
          "shadowHueBias": "blue-cyan",
          "forbidFlatSingleColorSnow": true
        }
      },
      "palette.pine-bark": {
        "id": "palette.pine-bark",
        "roles": {
          "crevice": [
            "#1B1C24",
            "#24232A"
          ],
          "body": [
            "#3B342F",
            "#50443A"
          ],
          "exposed": [
            "#665649",
            "#7A6755"
          ],
          "frosted": [
            "#6C7882"
          ]
        },
        "constraints": {
          "minimumValueSteps": 5,
          "warmth": "neutral-cool"
        }
      },
      "palette.pine-foliage": {
        "id": "palette.pine-foliage",
        "roles": {
          "deep": [
            "#10292B",
            "#173538"
          ],
          "body": [
            "#214548",
            "#2D5657"
          ],
          "lit": [
            "#3E6665",
            "#557878"
          ],
          "frosted": [
            "#6D8588"
          ]
        },
        "constraints": {
          "saturation": "low",
          "avoidBrightChristmasGreen": true,
          "minimumValueSteps": 5
        }
      },
      "palette.birch": {
        "id": "palette.birch",
        "roles": {
          "mark": [
            "#25272D",
            "#353942"
          ],
          "body": [
            "#7B858F",
            "#9AA5AD"
          ],
          "lit": [
            "#B9C2C8"
          ],
          "frosted": [
            "#D1D9DD"
          ]
        }
      },
      "palette.winter-ground": {
        "id": "palette.winter-ground",
        "roles": {
          "soil": [
            "#24282A",
            "#343737"
          ],
          "frozenGrass": [
            "#4B5045",
            "#666A57",
            "#777762"
          ],
          "lichen": [
            "#536360",
            "#697873"
          ],
          "deadNeedles": [
            "#4C4135",
            "#625342"
          ]
        }
      },
      "palette.glacial-rock": {
        "id": "palette.glacial-rock",
        "roles": {
          "crevice": [
            "#252D36",
            "#303B46"
          ],
          "body": [
            "#485563",
            "#5E6C78"
          ],
          "lit": [
            "#73818B",
            "#8A969E"
          ],
          "lichen": [
            "#66756E"
          ]
        }
      },
      "palette.atmosphere-blue-hour": {
        "id": "palette.atmosphere-blue-hour",
        "roles": {
          "zenith": [
            "#233E61"
          ],
          "horizon": [
            "#5F7F9D"
          ],
          "fogNear": [
            "#6F8AA1"
          ],
          "fogFar": [
            "#90A4B4"
          ],
          "optionalWarmFocalAccent": [
            "#B98E64"
          ]
        },
        "constraints": {
          "warmAccentScreenCoverageMax": 0.015,
          "dominantMood": "quiet, cold, blue, low-contrast distance"
        }
      }
    },
    "materials": {
      "material.snow.fresh": {
        "id": "material.snow.fresh",
        "semanticRole": "fresh powder snow",
        "palette": "palette.winter-snow",
        "rendererHints": {
          "roughness": [
            0.72,
            0.9
          ],
          "subsurface": [
            0.02,
            0.08
          ],
          "sparkleDensity": [
            0.0,
            0.015
          ],
          "normalBreakupScaleVoxels": [
            2,
            9
          ]
        },
        "surfaceRules": {
          "edgeShape": "rounded-irregular",
          "microPitting": "subtle",
          "forbidPerfectPlanarCaps": true
        }
      },
      "material.snow.compacted": {
        "id": "material.snow.compacted",
        "semanticRole": "wind-packed or compressed snow",
        "palette": "palette.winter-snow",
        "rendererHints": {
          "roughness": [
            0.48,
            0.7
          ],
          "valueOffset": -0.08,
          "specular": [
            0.18,
            0.3
          ]
        }
      },
      "material.bark.pine": {
        "id": "material.bark.pine",
        "semanticRole": "dark cold pine bark",
        "palette": "palette.pine-bark",
        "rendererHints": {
          "roughness": [
            0.76,
            0.95
          ]
        },
        "surfaceRules": {
          "fissureDirection": "mostly-vertical-with-branching",
          "fissureDepthVoxels": [
            1,
            3
          ],
          "patchScaleVoxels": [
            3,
            14
          ]
        }
      },
      "material.foliage.conifer": {
        "id": "material.foliage.conifer",
        "semanticRole": "cold desaturated evergreen foliage",
        "palette": "palette.pine-foliage",
        "rendererHints": {
          "roughness": [
            0.55,
            0.78
          ]
        },